{
  "$schema": "https://json-schema.org/draft/2020-12/schema",
  "title": "I System Menu Items",
  "type": "object",
  "properties": {
    "accounts": {
      "$ref": "./SystemMenuItem.schema.json"
    },
    "notes": {
      "$ref": "./SystemMenuItem.schema.json"
    },
    "events": {
      "$ref": "./SystemMenuItem.schema.json"
    },
    "pays": {
      "$ref": "./SystemMenuItem.schema.json"
    },
    "settings": {
      "$ref": "./SystemMenuItem.schema.json"
    }
  },
  "required": [
    "accounts",
    "notes",
    "events",
    "pays",
    "settings"
  ],
  "additionalProperties": false
}